=== IBM PDF EXTRACTION STARTED ===
PDF: 4 pages, extracting data...
Total lines extracted: 187
Extracting header information...
MEP found in next line: '243.386,00' -> cleaned: '243.386,00' -> 243386.0
MEP found in next line: '243.386,00' -> cleaned: '243.386,00' -> 243386.0
MEP found in next line: '243.386,00' -> cleaned: '243.386,00' -> 243386.0
MEP found in next line: '243.386,00' -> cleaned: '243.386,00' -> 243386.0
MEP found in next line: '243.386,00' -> cleaned: '243.386,00' -> 243386.0
MEP found in next line: '243.386,00' -> cleaned: '243.386,00' -> 243386.0
MEP found in next line: '243.386,00' -> cleaned: '243.386,00' -> 243386.0
MEP found in next line: '243.386,00' -> cleaned: '243.386,00' -> 243386.0
MEP found in next line: '243.386,00' -> cleaned: '243.386,00' -> 243386.0
MEP found in next line: '243.386,00' -> cleaned: '243.386,00' -> 243386.0
MEP found in next line: '243.386,00' -> cleaned: '243.386,00' -> 243386.0
MEP found in next line: '243.386,00' -> cleaned: '243.386,00' -> 243386.0
MEP found in next line: '243.386,00' -> cleaned: '243.386,00' -> 243386.0
MEP found in next line: '243.386,00' -> cleaned: '243.386,00' -> 243386.0
MEP found in next line: '243.386,00' -> cleaned: '243.386,00' -> 243386.0
MEP found in next line: '243.386,00' -> cleaned: '243.386,00' -> 243386.0
MEP found in next line: '243.386,00' -> cleaned: '243.386,00' -> 243386.0
MEP found in next line: '243.386,00' -> cleaned: '243.386,00' -> 243386.0
MEP found in next line: '243.386,00' -> cleaned: '243.386,00' -> 243386.0
MEP found in next line: '243.386,00' -> cleaned: '243.386,00' -> 243386.0
MEP found in next line: '243.386,00' -> cleaned: '243.386,00' -> 243386.0
MEP found in next line: '243.386,00' -> cleaned: '243.386,00' -> 243386.0
MEP found in next line: '243.386,00' -> cleaned: '243.386,00' -> 243386.0
MEP found in next line: '243.386,00' -> cleaned: '243.386,00' -> 243386.0
MEP found in next line: '243.386,00' -> cleaned: '243.386,00' -> 243386.0
MEP found in next line: '243.386,00' -> cleaned: '243.386,00' -> 243386.0
MEP found in next line: '243.386,00' -> cleaned: '243.386,00' -> 243386.0
MEP found in next line: '243.386,00' -> cleaned: '243.386,00' -> 243386.0
MEP found in next line: '243.386,00' -> cleaned: '243.386,00' -> 243386.0
MEP found in next line: '243.386,00' -> cleaned: '243.386,00' -> 243386.0
MEP found in next line: '243.386,00' -> cleaned: '243.386,00' -> 243386.0
MEP found in next line: '243.386,00' -> cleaned: '243.386,00' -> 243386.0
MEP found in next line: '243.386,00' -> cleaned: '243.386,00' -> 243386.0
MEP found in next line: '243.386,00' -> cleaned: '243.386,00' -> 243386.0
MEP found in next line: '243.386,00' -> cleaned: '243.386,00' -> 243386.0
MEP found in next line: '243.386,00' -> cleaned: '243.386,00' -> 243386.0
MEP found in next line: '243.386,00' -> cleaned: '243.386,00' -> 243386.0
MEP found in next line: '243.386,00' -> cleaned: '243.386,00' -> 243386.0
MEP found in next line: '243.386,00' -> cleaned: '243.386,00' -> 243386.0
MEP found in next line: '243.386,00' -> cleaned: '243.386,00' -> 243386.0
MEP found in next line: '243.386,00' -> cleaned: '243.386,00' -> 243386.0
MEP found in next line: '243.386,00' -> cleaned: '243.386,00' -> 243386.0
MEP found in next line: '243.386,00' -> cleaned: '243.386,00' -> 243386.0
MEP found in next line: '243.386,00' -> cleaned: '243.386,00' -> 243386.0
MEP found in next line: '243.386,00' -> cleaned: '243.386,00' -> 243386.0
MEP found in next line: '243.386,00' -> cleaned: '243.386,00' -> 243386.0
MEP found in next line: '243.386,00' -> cleaned: '243.386,00' -> 243386.0
MEP found in next line: '243.386,00' -> cleaned: '243.386,00' -> 243386.0
MEP found in next line: '243.386,00' -> cleaned: '243.386,00' -> 243386.0
MEP found in next line: '243.386,00' -> cleaned: '243.386,00' -> 243386.0
MEP found in next line: '243.386,00' -> cleaned: '243.386,00' -> 243386.0
MEP found in next line: '243.386,00' -> cleaned: '243.386,00' -> 243386.0
MEP found in next line: '243.386,00' -> cleaned: '243.386,00' -> 243386.0
MEP found in next line: '243.386,00' -> cleaned: '243.386,00' -> 243386.0
MEP found in next line: '243.386,00' -> cleaned: '243.386,00' -> 243386.0
MEP found in next line: '243.386,00' -> cleaned: '243.386,00' -> 243386.0
MEP found in next line: '243.386,00' -> cleaned: '243.386,00' -> 243386.0
MEP found in next line: '243.386,00' -> cleaned: '243.386,00' -> 243386.0
MEP found in next line: '243.386,00' -> cleaned: '243.386,00' -> 243386.0
MEP found in next line: '243.386,00' -> cleaned: '243.386,00' -> 243386.0
MEP found in next line: '243.386,00' -> cleaned: '243.386,00' -> 243386.0
MEP found in next line: '243.386,00' -> cleaned: '243.386,00' -> 243386.0
MEP found in next line: '243.386,00' -> cleaned: '243.386,00' -> 243386.0
MEP found in next line: '243.386,00' -> cleaned: '243.386,00' -> 243386.0
MEP found in next line: '243.386,00' -> cleaned: '243.386,00' -> 243386.0
MEP found in next line: '243.386,00' -> cleaned: '243.386,00' -> 243386.0
MEP found in next line: '243.386,00' -> cleaned: '243.386,00' -> 243386.0
MEP found in next line: '243.386,00' -> cleaned: '243.386,00' -> 243386.0
MEP found in next line: '243.386,00' -> cleaned: '243.386,00' -> 243386.0
MEP found in next line: '243.386,00' -> cleaned: '243.386,00' -> 243386.0
MEP found in next line: '243.386,00' -> cleaned: '243.386,00' -> 243386.0
MEP found in next line: '243.386,00' -> cleaned: '243.386,00' -> 243386.0
MEP found in next line: '243.386,00' -> cleaned: '243.386,00' -> 243386.0
MEP found in next line: '243.386,00' -> cleaned: '243.386,00' -> 243386.0
MEP found in next line: '243.386,00' -> cleaned: '243.386,00' -> 243386.0
MEP found in next line: '243.386,00' -> cleaned: '243.386,00' -> 243386.0
MEP found in next line: '243.386,00' -> cleaned: '243.386,00' -> 243386.0
MEP found in next line: '243.386,00' -> cleaned: '243.386,00' -> 243386.0
MEP found in next line: '243.386,00' -> cleaned: '243.386,00' -> 243386.0
MEP found in next line: '243.386,00' -> cleaned: '243.386,00' -> 243386.0
MEP found in next line: '243.386,00' -> cleaned: '243.386,00' -> 243386.0
MEP found in next line: '243.386,00' -> cleaned: '243.386,00' -> 243386.0
MEP found in next line: '243.386,00' -> cleaned: '243.386,00' -> 243386.0
MEP found in next line: '243.386,00' -> cleaned: '243.386,00' -> 243386.0
MEP found in next line: '243.386,00' -> cleaned: '243.386,00' -> 243386.0
MEP found in next line: '243.386,00' -> cleaned: '243.386,00' -> 243386.0
MEP found in next line: '243.386,00' -> cleaned: '243.386,00' -> 243386.0
MEP found in next line: '243.386,00' -> cleaned: '243.386,00' -> 243386.0
MEP found in next line: '243.386,00' -> cleaned: '243.386,00' -> 243386.0
MEP found in next line: '243.386,00' -> cleaned: '243.386,00' -> 243386.0
MEP found in next line: '243.386,00' -> cleaned: '243.386,00' -> 243386.0
MEP found in next line: '243.386,00' -> cleaned: '243.386,00' -> 243386.0
MEP found in next line: '243.386,00' -> cleaned: '243.386,00' -> 243386.0
MEP found in next line: '243.386,00' -> cleaned: '243.386,00' -> 243386.0
MEP found in next line: '243.386,00' -> cleaned: '243.386,00' -> 243386.0
MEP found in next line: '243.386,00' -> cleaned: '243.386,00' -> 243386.0
MEP found in next line: '243.386,00' -> cleaned: '243.386,00' -> 243386.0
MEP found in next line: '243.386,00' -> cleaned: '243.386,00' -> 243386.0
MEP found in next line: '243.386,00' -> cleaned: '243.386,00' -> 243386.0
MEP found in next line: '243.386,00' -> cleaned: '243.386,00' -> 243386.0
MEP found in next line: '243.386,00' -> cleaned: '243.386,00' -> 243386.0
MEP found in next line: '243.386,00' -> cleaned: '243.386,00' -> 243386.0
MEP found in next line: '243.386,00' -> cleaned: '243.386,00' -> 243386.0
MEP found in next line: '243.386,00' -> cleaned: '243.386,00' -> 243386.0
MEP found in next line: '243.386,00' -> cleaned: '243.386,00' -> 243386.0
MEP found in next line: '243.386,00' -> cleaned: '243.386,00' -> 243386.0
MEP found in next line: '243.386,00' -> cleaned: '243.386,00' -> 243386.0
MEP found in next line: '243.386,00' -> cleaned: '243.386,00' -> 243386.0
MEP found in next line: '243.386,00' -> cleaned: '243.386,00' -> 243386.0
MEP found in next line: '243.386,00' -> cleaned: '243.386,00' -> 243386.0
MEP found in next line: '243.386,00' -> cleaned: '243.386,00' -> 243386.0
MEP found in next line: '243.386,00' -> cleaned: '243.386,00' -> 243386.0
MEP found in next line: '243.386,00' -> cleaned: '243.386,00' -> 243386.0
MEP found in next line: '243.386,00' -> cleaned: '243.386,00' -> 243386.0
MEP found in next line: '243.386,00' -> cleaned: '243.386,00' -> 243386.0
MEP found in next line: '243.386,00' -> cleaned: '243.386,00' -> 243386.0
MEP found in next line: '243.386,00' -> cleaned: '243.386,00' -> 243386.0
MEP found in next line: '243.386,00' -> cleaned: '243.386,00' -> 243386.0
MEP found in next line: '243.386,00' -> cleaned: '243.386,00' -> 243386.0
MEP found in next line: '243.386,00' -> cleaned: '243.386,00' -> 243386.0
MEP found in next line: '243.386,00' -> cleaned: '243.386,00' -> 243386.0
MEP found in next line: '243.386,00' -> cleaned: '243.386,00' -> 243386.0
MEP found in next line: '243.386,00' -> cleaned: '243.386,00' -> 243386.0
MEP found in next line: '243.386,00' -> cleaned: '243.386,00' -> 243386.0
MEP found in next line: '243.386,00' -> cleaned: '243.386,00' -> 243386.0
MEP found in next line: '243.386,00' -> cleaned: '243.386,00' -> 243386.0
MEP found in next line: '243.386,00' -> cleaned: '243.386,00' -> 243386.0
MEP found in next line: '243.386,00' -> cleaned: '243.386,00' -> 243386.0
MEP found in next line: '243.386,00' -> cleaned: '243.386,00' -> 243386.0
MEP found in next line: '243.386,00' -> cleaned: '243.386,00' -> 243386.0
MEP found in next line: '243.386,00' -> cleaned: '243.386,00' -> 243386.0
MEP found in next line: '243.386,00' -> cleaned: '243.386,00' -> 243386.0
MEP found in next line: '243.386,00' -> cleaned: '243.386,00' -> 243386.0
MEP found in next line: '243.386,00' -> cleaned: '243.386,00' -> 243386.0
MEP found in next line: '243.386,00' -> cleaned: '243.386,00' -> 243386.0
MEP found in next line: '243.386,00' -> cleaned: '243.386,00' -> 243386.0
MEP found in next line: '243.386,00' -> cleaned: '243.386,00' -> 243386.0
MEP found in next line: '243.386,00' -> cleaned: '243.386,00' -> 243386.0
MEP found in next line: '243.386,00' -> cleaned: '243.386,00' -> 243386.0
MEP found in next line: '243.386,00' -> cleaned: '243.386,00' -> 243386.0
MEP found in next line: '243.386,00' -> cleaned: '243.386,00' -> 243386.0
MEP found in next line: '243.386,00' -> cleaned: '243.386,00' -> 243386.0
MEP found in next line: '243.386,00' -> cleaned: '243.386,00' -> 243386.0
MEP found in next line: '243.386,00' -> cleaned: '243.386,00' -> 243386.0
MEP found in next line: '243.386,00' -> cleaned: '243.386,00' -> 243386.0
MEP found in next line: '243.386,00' -> cleaned: '243.386,00' -> 243386.0
MEP found in next line: '243.386,00' -> cleaned: '243.386,00' -> 243386.0
MEP found in next line: '243.386,00' -> cleaned: '243.386,00' -> 243386.0
MEP found in next line: '243.386,00' -> cleaned: '243.386,00' -> 243386.0
MEP found in next line: '243.386,00' -> cleaned: '243.386,00' -> 243386.0
MEP found in next line: '243.386,00' -> cleaned: '243.386,00' -> 243386.0
MEP found in next line: '243.386,00' -> cleaned: '243.386,00' -> 243386.0
MEP found in next line: '243.386,00' -> cleaned: '243.386,00' -> 243386.0
MEP found in next line: '243.386,00' -> cleaned: '243.386,00' -> 243386.0
MEP found in next line: '243.386,00' -> cleaned: '243.386,00' -> 243386.0
MEP found in next line: '243.386,00' -> cleaned: '243.386,00' -> 243386.0
MEP found in next line: '243.386,00' -> cleaned: '243.386,00' -> 243386.0
MEP found in next line: '243.386,00' -> cleaned: '243.386,00' -> 243386.0
MEP found in next line: '243.386,00' -> cleaned: '243.386,00' -> 243386.0
MEP found in next line: '243.386,00' -> cleaned: '243.386,00' -> 243386.0
MEP found in next line: '243.386,00' -> cleaned: '243.386,00' -> 243386.0
MEP found in next line: '243.386,00' -> cleaned: '243.386,00' -> 243386.0
MEP found in next line: '243.386,00' -> cleaned: '243.386,00' -> 243386.0
MEP found in next line: '243.386,00' -> cleaned: '243.386,00' -> 243386.0
MEP found in next line: '243.386,00' -> cleaned: '243.386,00' -> 243386.0
MEP found in next line: '243.386,00' -> cleaned: '243.386,00' -> 243386.0
MEP found in next line: '243.386,00' -> cleaned: '243.386,00' -> 243386.0
MEP found in next line: '243.386,00' -> cleaned: '243.386,00' -> 243386.0
MEP found in next line: '243.386,00' -> cleaned: '243.386,00' -> 243386.0
MEP found in next line: '243.386,00' -> cleaned: '243.386,00' -> 243386.0
MEP found in next line: '243.386,00' -> cleaned: '243.386,00' -> 243386.0
MEP found in next line: '243.386,00' -> cleaned: '243.386,00' -> 243386.0
MEP found in next line: '243.386,00' -> cleaned: '243.386,00' -> 243386.0
MEP found in next line: '243.386,00' -> cleaned: '243.386,00' -> 243386.0
MEP found in next line: '243.386,00' -> cleaned: '243.386,00' -> 243386.0
MEP found in next line: '243.386,00' -> cleaned: '243.386,00' -> 243386.0
MEP found in next line: '243.386,00' -> cleaned: '243.386,00' -> 243386.0
MEP found in next line: '243.386,00' -> cleaned: '243.386,00' -> 243386.0
MEP found in next line: '243.386,00' -> cleaned: '243.386,00' -> 243386.0
MEP found in next line: '243.386,00' -> cleaned: '243.386,00' -> 243386.0
MEP found in next line: '243.386,00' -> cleaned: '243.386,00' -> 243386.0
MEP found in next line: '243.386,00' -> cleaned: '243.386,00' -> 243386.0
MEP found in next line: '243.386,00' -> cleaned: '243.386,00' -> 243386.0
MEP found in next line: '243.386,00' -> cleaned: '243.386,00' -> 243386.0
MEP found in next line: '243.386,00' -> cleaned: '243.386,00' -> 243386.0
MEP found in next line: '243.386,00' -> cleaned: '243.386,00' -> 243386.0
MEP found in next line: '243.386,00' -> cleaned: '243.386,00' -> 243386.0
MEP found in next line: '243.386,00' -> cleaned: '243.386,00' -> 243386.0
Header fields found: 8
MEP extracted: '243,386.00')
Bid Expiration Date: '31-Dec-2025')
Extracting line items...
=== RAW PDF CONTENT FOR SKU D28AYLL ===
Chunk lines from PDF:
  Line 0: '1'
  Line 1: 'D28AYLL'
  Line 2: 'MAPST APPNT LIC + S&'
  Line 3: '13,30'
  Line 4: '1729,00 23-Oct-2025'
  Line 5: '31-Oct-2026'
  Line 6: '130'
  Line 7: '2.748,00'
  Line 8: '357.240,00'
  Line 9: '51,960'
  Line 10: '1.320,14'
  Line 11: '171.618,20'
Money tokens found: ['2.748,00', '357.240,00', '51,960', '1.320,14', '171.618,20']
Date range: 23-Oct-2025 to 31-Oct-2026
==================================================
=== PRICE ANALYSIS FOR SKU D28AYLL ===
All money tokens from PDF: ['2.748,00', '357.240,00', '51,960', '1.320,14', '171.618,20']
  Token 0: '2.748,00' = 2748.0
  Token 1: '357.240,00' = 357240.0
  Token 2: '51,960' = 51.96
  Token 3: '1.320,14' = 1320.14
  Token 4: '171.618,20' = 171618.2
All parsed values:
  Position 0: '2.748,00' = 2748.0
  Position 1: '357.240,00' = 357240.0
  Position 2: '51,960' = 51.96
  Position 3: '1.320,14' = 1320.14
  Position 4: '171.618,20' = 171618.2
FOUND EXTENDED COST: Position 4 '171.618,20' = 171618.2
USING EXTENDED COST: Unit=1320.14, Extended=171618.2
SELECTED: Using Extended=171618.2, Unit=1320.14
FINAL: Unit=1320.14, Total=171618.2
==================================================
=== RAW PDF CONTENT FOR SKU E0R1HLL ===
Chunk lines from PDF:
  Line 0: '2'
  Line 1: 'E0R1HLL'
  Line 2: 'MXAPST APPNT ANNUAL'
  Line 3: '2,65'
  Line 4: '344,50 01-Nov-2026'
  Line 5: '31-Oct-2027'
  Line 6: '130'
  Line 7: '549,00'
  Line 8: '71.370,00'
  Line 9: '50,460'
  Line 10: '271,95'
  Line 11: '35.353,50'
Money tokens found: ['549,00', '71.370,00', '50,460', '271,95', '35.353,50']
Date range: 01-Nov-2026 to 31-Oct-2027
==================================================
=== PRICE ANALYSIS FOR SKU E0R1HLL ===
All money tokens from PDF: ['549,00', '71.370,00', '50,460', '271,95', '35.353,50']
  Token 0: '549,00' = 549.0
  Token 1: '71.370,00' = 71370.0
  Token 2: '50,460' = 50.46
  Token 3: '271,95' = 271.95
  Token 4: '35.353,50' = 35353.5
All parsed values:
  Position 0: '549,00' = 549.0
  Position 1: '71.370,00' = 71370.0
  Position 2: '50,460' = 50.46
  Position 3: '271,95' = 271.95
  Position 4: '35.353,50' = 35353.5
FOUND EXTENDED COST: Position 4 '35.353,50' = 35353.5
USING EXTENDED COST: Unit=271.95, Extended=35353.5
SELECTED: Using Extended=35353.5, Unit=271.95
FINAL: Unit=271.95, Total=35353.5
==================================================
=== RAW PDF CONTENT FOR SKU E0R1HLL ===
Chunk lines from PDF:
  Line 0: '006gR000000pzB9QAI'
  Line 1: '3'
  Line 2: 'E0R1HLL'
  Line 3: 'MXAPST APPNT ANNUAL'
  Line 4: '2,65'
  Line 5: '344,50 01-Nov-2027'
  Line 6: '31-Oct-2028'
  Line 7: '130'
  Line 8: '549,00'
  Line 9: '71.370,00'
  Line 10: '48,980'
  Line 11: '280,11'
Money tokens found: ['549,00', '71.370,00', '48,980', '280,11']
Date range: 01-Nov-2027 to 31-Oct-2028
==================================================
=== PRICE ANALYSIS FOR SKU E0R1HLL ===
All money tokens from PDF: ['549,00', '71.370,00', '48,980', '280,11', '36.414,30', '3,000']
  Token 0: '549,00' = 549.0
  Token 1: '71.370,00' = 71370.0
  Token 2: '48,980' = 48.98
  Token 3: '280,11' = 280.11
  Token 4: '36.414,30' = 36414.3
  Token 5: '3,000' = 3.0
All parsed values:
  Position 0: '549,00' = 549.0
  Position 1: '71.370,00' = 71370.0
  Position 2: '48,980' = 48.98
  Position 3: '280,11' = 280.11
  Position 4: '36.414,30' = 36414.3
  Position 5: '3,000' = 3.0
FOUND EXTENDED COST: Position 4 '36.414,30' = 36414.3
FOUND UNIT COST: Position 5 '3,000' = 3.0
USING EXTENDED COST: Unit=280.11, Extended=36414.3
SELECTED: Using Extended=36414.3, Unit=280.11
FINAL: Unit=280.11, Total=36414.3
==================================================
=== EXTRACTION COMPLETE ===
Total line items: 3
Total quotation value: AED 893,835.09
=== FINAL EXCEL DATA ===
Row 1: D28AYLL | Qty: 130 | Unit: AED 4848.21 | Total: AED 630267.84
Row 2: E0R1HLL | Qty: 130 | Unit: AED 998.74 | Total: AED 129835.73
Row 3: E0R1HLL | Qty: 130 | Unit: AED 1028.70 | Total: AED 133731.52
=== IBM PDF EXTRACTION STARTED ===
PDF: 4 pages, extracting data...
Total lines extracted: 187
Extracting header information...
MEP found in next line: '243.386,00' -> cleaned: '243.386,00' -> 243386.0
MEP found in next line: '243.386,00' -> cleaned: '243.386,00' -> 243386.0
MEP found in next line: '243.386,00' -> cleaned: '243.386,00' -> 243386.0
MEP found in next line: '243.386,00' -> cleaned: '243.386,00' -> 243386.0
MEP found in next line: '243.386,00' -> cleaned: '243.386,00' -> 243386.0
MEP found in next line: '243.386,00' -> cleaned: '243.386,00' -> 243386.0
MEP found in next line: '243.386,00' -> cleaned: '243.386,00' -> 243386.0
MEP found in next line: '243.386,00' -> cleaned: '243.386,00' -> 243386.0
MEP found in next line: '243.386,00' -> cleaned: '243.386,00' -> 243386.0
MEP found in next line: '243.386,00' -> cleaned: '243.386,00' -> 243386.0
MEP found in next line: '243.386,00' -> cleaned: '243.386,00' -> 243386.0
MEP found in next line: '243.386,00' -> cleaned: '243.386,00' -> 243386.0
MEP found in next line: '243.386,00' -> cleaned: '243.386,00' -> 243386.0
MEP found in next line: '243.386,00' -> cleaned: '243.386,00' -> 243386.0
MEP found in next line: '243.386,00' -> cleaned: '243.386,00' -> 243386.0
MEP found in next line: '243.386,00' -> cleaned: '243.386,00' -> 243386.0
MEP found in next line: '243.386,00' -> cleaned: '243.386,00' -> 243386.0
MEP found in next line: '243.386,00' -> cleaned: '243.386,00' -> 243386.0
MEP found in next line: '243.386,00' -> cleaned: '243.386,00' -> 243386.0
MEP found in next line: '243.386,00' -> cleaned: '243.386,00' -> 243386.0
MEP found in next line: '243.386,00' -> cleaned: '243.386,00' -> 243386.0
MEP found in next line: '243.386,00' -> cleaned: '243.386,00' -> 243386.0
MEP found in next line: '243.386,00' -> cleaned: '243.386,00' -> 243386.0
MEP found in next line: '243.386,00' -> cleaned: '243.386,00' -> 243386.0
MEP found in next line: '243.386,00' -> cleaned: '243.386,00' -> 243386.0
MEP found in next line: '243.386,00' -> cleaned: '243.386,00' -> 243386.0
MEP found in next line: '243.386,00' -> cleaned: '243.386,00' -> 243386.0
MEP found in next line: '243.386,00' -> cleaned: '243.386,00' -> 243386.0
MEP found in next line: '243.386,00' -> cleaned: '243.386,00' -> 243386.0
MEP found in next line: '243.386,00' -> cleaned: '243.386,00' -> 243386.0
MEP found in next line: '243.386,00' -> cleaned: '243.386,00' -> 243386.0
MEP found in next line: '243.386,00' -> cleaned: '243.386,00' -> 243386.0
MEP found in next line: '243.386,00' -> cleaned: '243.386,00' -> 243386.0
MEP found in next line: '243.386,00' -> cleaned: '243.386,00' -> 243386.0
MEP found in next line: '243.386,00' -> cleaned: '243.386,00' -> 243386.0
MEP found in next line: '243.386,00' -> cleaned: '243.386,00' -> 243386.0
MEP found in next line: '243.386,00' -> cleaned: '243.386,00' -> 243386.0
MEP found in next line: '243.386,00' -> cleaned: '243.386,00' -> 243386.0
MEP found in next line: '243.386,00' -> cleaned: '243.386,00' -> 243386.0
MEP found in next line: '243.386,00' -> cleaned: '243.386,00' -> 243386.0
MEP found in next line: '243.386,00' -> cleaned: '243.386,00' -> 243386.0
MEP found in next line: '243.386,00' -> cleaned: '243.386,00' -> 243386.0
MEP found in next line: '243.386,00' -> cleaned: '243.386,00' -> 243386.0
MEP found in next line: '243.386,00' -> cleaned: '243.386,00' -> 243386.0
MEP found in next line: '243.386,00' -> cleaned: '243.386,00' -> 243386.0
MEP found in next line: '243.386,00' -> cleaned: '243.386,00' -> 243386.0
MEP found in next line: '243.386,00' -> cleaned: '243.386,00' -> 243386.0
MEP found in next line: '243.386,00' -> cleaned: '243.386,00' -> 243386.0
MEP found in next line: '243.386,00' -> cleaned: '243.386,00' -> 243386.0
MEP found in next line: '243.386,00' -> cleaned: '243.386,00' -> 243386.0
MEP found in next line: '243.386,00' -> cleaned: '243.386,00' -> 243386.0
MEP found in next line: '243.386,00' -> cleaned: '243.386,00' -> 243386.0
MEP found in next line: '243.386,00' -> cleaned: '243.386,00' -> 243386.0
MEP found in next line: '243.386,00' -> cleaned: '243.386,00' -> 243386.0
MEP found in next line: '243.386,00' -> cleaned: '243.386,00' -> 243386.0
MEP found in next line: '243.386,00' -> cleaned: '243.386,00' -> 243386.0
MEP found in next line: '243.386,00' -> cleaned: '243.386,00' -> 243386.0
MEP found in next line: '243.386,00' -> cleaned: '243.386,00' -> 243386.0
MEP found in next line: '243.386,00' -> cleaned: '243.386,00' -> 243386.0
MEP found in next line: '243.386,00' -> cleaned: '243.386,00' -> 243386.0
MEP found in next line: '243.386,00' -> cleaned: '243.386,00' -> 243386.0
MEP found in next line: '243.386,00' -> cleaned: '243.386,00' -> 243386.0
MEP found in next line: '243.386,00' -> cleaned: '243.386,00' -> 243386.0
MEP found in next line: '243.386,00' -> cleaned: '243.386,00' -> 243386.0
MEP found in next line: '243.386,00' -> cleaned: '243.386,00' -> 243386.0
MEP found in next line: '243.386,00' -> cleaned: '243.386,00' -> 243386.0
MEP found in next line: '243.386,00' -> cleaned: '243.386,00' -> 243386.0
MEP found in next line: '243.386,00' -> cleaned: '243.386,00' -> 243386.0
MEP found in next line: '243.386,00' -> cleaned: '243.386,00' -> 243386.0
MEP found in next line: '243.386,00' -> cleaned: '243.386,00' -> 243386.0
MEP found in next line: '243.386,00' -> cleaned: '243.386,00' -> 243386.0
MEP found in next line: '243.386,00' -> cleaned: '243.386,00' -> 243386.0
MEP found in next line: '243.386,00' -> cleaned: '243.386,00' -> 243386.0
MEP found in next line: '243.386,00' -> cleaned: '243.386,00' -> 243386.0
MEP found in next line: '243.386,00' -> cleaned: '243.386,00' -> 243386.0
MEP found in next line: '243.386,00' -> cleaned: '243.386,00' -> 243386.0
MEP found in next line: '243.386,00' -> cleaned: '243.386,00' -> 243386.0
MEP found in next line: '243.386,00' -> cleaned: '243.386,00' -> 243386.0
MEP found in next line: '243.386,00' -> cleaned: '243.386,00' -> 243386.0
MEP found in next line: '243.386,00' -> cleaned: '243.386,00' -> 243386.0
MEP found in next line: '243.386,00' -> cleaned: '243.386,00' -> 243386.0
MEP found in next line: '243.386,00' -> cleaned: '243.386,00' -> 243386.0
MEP found in next line: '243.386,00' -> cleaned: '243.386,00' -> 243386.0
MEP found in next line: '243.386,00' -> cleaned: '243.386,00' -> 243386.0
MEP found in next line: '243.386,00' -> cleaned: '243.386,00' -> 243386.0
MEP found in next line: '243.386,00' -> cleaned: '243.386,00' -> 243386.0
MEP found in next line: '243.386,00' -> cleaned: '243.386,00' -> 243386.0
MEP found in next line: '243.386,00' -> cleaned: '243.386,00' -> 243386.0
MEP found in next line: '243.386,00' -> cleaned: '243.386,00' -> 243386.0
MEP found in next line: '243.386,00' -> cleaned: '243.386,00' -> 243386.0
MEP found in next line: '243.386,00' -> cleaned: '243.386,00' -> 243386.0
MEP found in next line: '243.386,00' -> cleaned: '243.386,00' -> 243386.0
MEP found in next line: '243.386,00' -> cleaned: '243.386,00' -> 243386.0
MEP found in next line: '243.386,00' -> cleaned: '243.386,00' -> 243386.0
MEP found in next line: '243.386,00' -> cleaned: '243.386,00' -> 243386.0
MEP found in next line: '243.386,00' -> cleaned: '243.386,00' -> 243386.0
MEP found in next line: '243.386,00' -> cleaned: '243.386,00' -> 243386.0
MEP found in next line: '243.386,00' -> cleaned: '243.386,00' -> 243386.0
MEP found in next line: '243.386,00' -> cleaned: '243.386,00' -> 243386.0
MEP found in next line: '243.386,00' -> cleaned: '243.386,00' -> 243386.0
MEP found in next line: '243.386,00' -> cleaned: '243.386,00' -> 243386.0
MEP found in next line: '243.386,00' -> cleaned: '243.386,00' -> 243386.0
MEP found in next line: '243.386,00' -> cleaned: '243.386,00' -> 243386.0
MEP found in next line: '243.386,00' -> cleaned: '243.386,00' -> 243386.0
MEP found in next line: '243.386,00' -> cleaned: '243.386,00' -> 243386.0
MEP found in next line: '243.386,00' -> cleaned: '243.386,00' -> 243386.0
MEP found in next line: '243.386,00' -> cleaned: '243.386,00' -> 243386.0
MEP found in next line: '243.386,00' -> cleaned: '243.386,00' -> 243386.0
MEP found in next line: '243.386,00' -> cleaned: '243.386,00' -> 243386.0
MEP found in next line: '243.386,00' -> cleaned: '243.386,00' -> 243386.0
MEP found in next line: '243.386,00' -> cleaned: '243.386,00' -> 243386.0
MEP found in next line: '243.386,00' -> cleaned: '243.386,00' -> 243386.0
MEP found in next line: '243.386,00' -> cleaned: '243.386,00' -> 243386.0
MEP found in next line: '243.386,00' -> cleaned: '243.386,00' -> 243386.0
MEP found in next line: '243.386,00' -> cleaned: '243.386,00' -> 243386.0
MEP found in next line: '243.386,00' -> cleaned: '243.386,00' -> 243386.0
MEP found in next line: '243.386,00' -> cleaned: '243.386,00' -> 243386.0
MEP found in next line: '243.386,00' -> cleaned: '243.386,00' -> 243386.0
MEP found in next line: '243.386,00' -> cleaned: '243.386,00' -> 243386.0
MEP found in next line: '243.386,00' -> cleaned: '243.386,00' -> 243386.0
MEP found in next line: '243.386,00' -> cleaned: '243.386,00' -> 243386.0
MEP found in next line: '243.386,00' -> cleaned: '243.386,00' -> 243386.0
MEP found in next line: '243.386,00' -> cleaned: '243.386,00' -> 243386.0
MEP found in next line: '243.386,00' -> cleaned: '243.386,00' -> 243386.0
MEP found in next line: '243.386,00' -> cleaned: '243.386,00' -> 243386.0
MEP found in next line: '243.386,00' -> cleaned: '243.386,00' -> 243386.0
MEP found in next line: '243.386,00' -> cleaned: '243.386,00' -> 243386.0
MEP found in next line: '243.386,00' -> cleaned: '243.386,00' -> 243386.0
MEP found in next line: '243.386,00' -> cleaned: '243.386,00' -> 243386.0
MEP found in next line: '243.386,00' -> cleaned: '243.386,00' -> 243386.0
MEP found in next line: '243.386,00' -> cleaned: '243.386,00' -> 243386.0
MEP found in next line: '243.386,00' -> cleaned: '243.386,00' -> 243386.0
MEP found in next line: '243.386,00' -> cleaned: '243.386,00' -> 243386.0
MEP found in next line: '243.386,00' -> cleaned: '243.386,00' -> 243386.0
MEP found in next line: '243.386,00' -> cleaned: '243.386,00' -> 243386.0
MEP found in next line: '243.386,00' -> cleaned: '243.386,00' -> 243386.0
MEP found in next line: '243.386,00' -> cleaned: '243.386,00' -> 243386.0
MEP found in next line: '243.386,00' -> cleaned: '243.386,00' -> 243386.0
MEP found in next line: '243.386,00' -> cleaned: '243.386,00' -> 243386.0
MEP found in next line: '243.386,00' -> cleaned: '243.386,00' -> 243386.0
MEP found in next line: '243.386,00' -> cleaned: '243.386,00' -> 243386.0
MEP found in next line: '243.386,00' -> cleaned: '243.386,00' -> 243386.0
MEP found in next line: '243.386,00' -> cleaned: '243.386,00' -> 243386.0
MEP found in next line: '243.386,00' -> cleaned: '243.386,00' -> 243386.0
MEP found in next line: '243.386,00' -> cleaned: '243.386,00' -> 243386.0
MEP found in next line: '243.386,00' -> cleaned: '243.386,00' -> 243386.0
MEP found in next line: '243.386,00' -> cleaned: '243.386,00' -> 243386.0
MEP found in next line: '243.386,00' -> cleaned: '243.386,00' -> 243386.0
MEP found in next line: '243.386,00' -> cleaned: '243.386,00' -> 243386.0
MEP found in next line: '243.386,00' -> cleaned: '243.386,00' -> 243386.0
MEP found in next line: '243.386,00' -> cleaned: '243.386,00' -> 243386.0
MEP found in next line: '243.386,00' -> cleaned: '243.386,00' -> 243386.0
MEP found in next line: '243.386,00' -> cleaned: '243.386,00' -> 243386.0
MEP found in next line: '243.386,00' -> cleaned: '243.386,00' -> 243386.0
MEP found in next line: '243.386,00' -> cleaned: '243.386,00' -> 243386.0
MEP found in next line: '243.386,00' -> cleaned: '243.386,00' -> 243386.0
MEP found in next line: '243.386,00' -> cleaned: '243.386,00' -> 243386.0
MEP found in next line: '243.386,00' -> cleaned: '243.386,00' -> 243386.0
MEP found in next line: '243.386,00' -> cleaned: '243.386,00' -> 243386.0
MEP found in next line: '243.386,00' -> cleaned: '243.386,00' -> 243386.0
MEP found in next line: '243.386,00' -> cleaned: '243.386,00' -> 243386.0
MEP found in next line: '243.386,00' -> cleaned: '243.386,00' -> 243386.0
MEP found in next line: '243.386,00' -> cleaned: '243.386,00' -> 243386.0
MEP found in next line: '243.386,00' -> cleaned: '243.386,00' -> 243386.0
MEP found in next line: '243.386,00' -> cleaned: '243.386,00' -> 243386.0
MEP found in next line: '243.386,00' -> cleaned: '243.386,00' -> 243386.0
MEP found in next line: '243.386,00' -> cleaned: '243.386,00' -> 243386.0
MEP found in next line: '243.386,00' -> cleaned: '243.386,00' -> 243386.0
MEP found in next line: '243.386,00' -> cleaned: '243.386,00' -> 243386.0
MEP found in next line: '243.386,00' -> cleaned: '243.386,00' -> 243386.0
MEP found in next line: '243.386,00' -> cleaned: '243.386,00' -> 243386.0
MEP found in next line: '243.386,00' -> cleaned: '243.386,00' -> 243386.0
MEP found in next line: '243.386,00' -> cleaned: '243.386,00' -> 243386.0
MEP found in next line: '243.386,00' -> cleaned: '243.386,00' -> 243386.0
MEP found in next line: '243.386,00' -> cleaned: '243.386,00' -> 243386.0
MEP found in next line: '243.386,00' -> cleaned: '243.386,00' -> 243386.0
MEP found in next line: '243.386,00' -> cleaned: '243.386,00' -> 243386.0
MEP found in next line: '243.386,00' -> cleaned: '243.386,00' -> 243386.0
MEP found in next line: '243.386,00' -> cleaned: '243.386,00' -> 243386.0
MEP found in next line: '243.386,00' -> cleaned: '243.386,00' -> 243386.0
MEP found in next line: '243.386,00' -> cleaned: '243.386,00' -> 243386.0
MEP found in next line: '243.386,00' -> cleaned: '243.386,00' -> 243386.0
MEP found in next line: '243.386,00' -> cleaned: '243.386,00' -> 243386.0
MEP found in next line: '243.386,00' -> cleaned: '243.386,00' -> 243386.0
MEP found in next line: '243.386,00' -> cleaned: '243.386,00' -> 243386.0
MEP found in next line: '243.386,00' -> cleaned: '243.386,00' -> 243386.0
MEP found in next line: '243.386,00' -> cleaned: '243.386,00' -> 243386.0
MEP found in next line: '243.386,00' -> cleaned: '243.386,00' -> 243386.0
Header fields found: 8
MEP extracted: '243,386.00')
Bid Expiration Date: '31-Dec-2025')
Extracting line items...
=== RAW PDF CONTENT FOR SKU D28AYLL ===
Chunk lines from PDF:
  Line 0: '1'
  Line 1: 'D28AYLL'
  Line 2: 'MAPST APPNT LIC + S&'
  Line 3: '13,30'
  Line 4: '1729,00 23-Oct-2025'
  Line 5: '31-Oct-2026'
  Line 6: '130'
  Line 7: '2.748,00'
  Line 8: '357.240,00'
  Line 9: '51,960'
  Line 10: '1.320,14'
  Line 11: '171.618,20'
Money tokens found: ['2.748,00', '357.240,00', '51,960', '1.320,14', '171.618,20']
Date range: 23-Oct-2025 to 31-Oct-2026
==================================================
=== PRICE ANALYSIS FOR SKU D28AYLL ===
All money tokens from PDF: ['2.748,00', '357.240,00', '51,960', '1.320,14', '171.618,20']
  Token 0: '2.748,00' = 2748.0
  Token 1: '357.240,00' = 357240.0
  Token 2: '51,960' = 51.96
  Token 3: '1.320,14' = 1320.14
  Token 4: '171.618,20' = 171618.2
All parsed values:
  Position 0: '2.748,00' = 2748.0
  Position 1: '357.240,00' = 357240.0
  Position 2: '51,960' = 51.96
  Position 3: '1.320,14' = 1320.14
  Position 4: '171.618,20' = 171618.2
FOUND EXTENDED COST: Position 4 '171.618,20' = 171618.2
USING EXTENDED COST: Unit=1320.14, Extended=171618.2
SELECTED: Using Extended=171618.2, Unit=1320.14
FINAL: Unit=1320.14, Total=171618.2
==================================================
=== RAW PDF CONTENT FOR SKU E0R1HLL ===
Chunk lines from PDF:
  Line 0: '2'
  Line 1: 'E0R1HLL'
  Line 2: 'MXAPST APPNT ANNUAL'
  Line 3: '2,65'
  Line 4: '344,50 01-Nov-2026'
  Line 5: '31-Oct-2027'
  Line 6: '130'
  Line 7: '549,00'
  Line 8: '71.370,00'
  Line 9: '50,460'
  Line 10: '271,95'
  Line 11: '35.353,50'
Money tokens found: ['549,00', '71.370,00', '50,460', '271,95', '35.353,50']
Date range: 01-Nov-2026 to 31-Oct-2027
==================================================
=== PRICE ANALYSIS FOR SKU E0R1HLL ===
All money tokens from PDF: ['549,00', '71.370,00', '50,460', '271,95', '35.353,50']
  Token 0: '549,00' = 549.0
  Token 1: '71.370,00' = 71370.0
  Token 2: '50,460' = 50.46
  Token 3: '271,95' = 271.95
  Token 4: '35.353,50' = 35353.5
All parsed values:
  Position 0: '549,00' = 549.0
  Position 1: '71.370,00' = 71370.0
  Position 2: '50,460' = 50.46
  Position 3: '271,95' = 271.95
  Position 4: '35.353,50' = 35353.5
FOUND EXTENDED COST: Position 4 '35.353,50' = 35353.5
USING EXTENDED COST: Unit=271.95, Extended=35353.5
SELECTED: Using Extended=35353.5, Unit=271.95
FINAL: Unit=271.95, Total=35353.5
==================================================
=== RAW PDF CONTENT FOR SKU E0R1HLL ===
Chunk lines from PDF:
  Line 0: '006gR000000pzB9QAI'
  Line 1: '3'
  Line 2: 'E0R1HLL'
  Line 3: 'MXAPST APPNT ANNUAL'
  Line 4: '2,65'
  Line 5: '344,50 01-Nov-2027'
  Line 6: '31-Oct-2028'
  Line 7: '130'
  Line 8: '549,00'
  Line 9: '71.370,00'
  Line 10: '48,980'
  Line 11: '280,11'
Money tokens found: ['549,00', '71.370,00', '48,980', '280,11']
Date range: 01-Nov-2027 to 31-Oct-2028
==================================================
=== PRICE ANALYSIS FOR SKU E0R1HLL ===
All money tokens from PDF: ['549,00', '71.370,00', '48,980', '280,11', '36.414,30', '3,000']
  Token 0: '549,00' = 549.0
  Token 1: '71.370,00' = 71370.0
  Token 2: '48,980' = 48.98
  Token 3: '280,11' = 280.11
  Token 4: '36.414,30' = 36414.3
  Token 5: '3,000' = 3.0
All parsed values:
  Position 0: '549,00' = 549.0
  Position 1: '71.370,00' = 71370.0
  Position 2: '48,980' = 48.98
  Position 3: '280,11' = 280.11
  Position 4: '36.414,30' = 36414.3
  Position 5: '3,000' = 3.0
FOUND EXTENDED COST: Position 4 '36.414,30' = 36414.3
FOUND UNIT COST: Position 5 '3,000' = 3.0
USING EXTENDED COST: Unit=280.11, Extended=36414.3
SELECTED: Using Extended=36414.3, Unit=280.11
FINAL: Unit=280.11, Total=36414.3
==================================================
=== EXTRACTION COMPLETE ===
Total line items: 3
Total quotation value: AED 893,835.09
=== FINAL EXCEL DATA ===
Row 1: D28AYLL | Qty: 130 | Unit: AED 4848.21 | Total: AED 630267.84
Row 2: E0R1HLL | Qty: 130 | Unit: AED 998.74 | Total: AED 129835.73
Row 3: E0R1HLL | Qty: 130 | Unit: AED 1028.70 | Total: AED 133731.52
