2026-01-19 13:27:11,993 - DEBUG - ================================================================================
2026-01-19 13:27:11,994 - DEBUG - MIBB HEADER EXTRACTION STARTED
2026-01-19 13:27:11,995 - DEBUG - ================================================================================
2026-01-19 13:27:11,996 - DEBUG - PDF opened successfully: 5 pages
2026-01-19 13:27:12,007 - DEBUG - Page 1: Extracted 25 lines
2026-01-19 13:27:12,015 - DEBUG - Page 2: Extracted 116 lines
2026-01-19 13:27:12,021 - DEBUG - Page 3: Extracted 102 lines
2026-01-19 13:27:12,032 - DEBUG - Page 4: Extracted 33 lines
2026-01-19 13:27:12,045 - DEBUG - Page 5: Extracted 36 lines
2026-01-19 13:27:12,047 - DEBUG - Total lines extracted: 312
2026-01-19 13:27:12,050 - DEBUG - 
First 50 lines of PDF:
2026-01-19 13:27:12,055 - DEBUG -   Line   0: Page 1 of 5
2026-01-19 13:27:12,058 - DEBUG -   Line   1: Customer Information
2026-01-19 13:27:12,060 - DEBUG -   Line   2: Customer Name: Orange Botswana [Pty] Ltd
2026-01-19 13:27:12,062 - DEBUG -   Line   3: Address: Botswana
2026-01-19 13:27:12,064 - DEBUG -   Line   4: City: Gaborone
2026-01-19 13:27:12,065 - DEBUG -   Line   5: Country: Botswana
2026-01-19 13:27:12,066 - DEBUG -   Line   6: Government Entity (GOE): No
2026-01-19 13:27:12,067 - DEBUG -   Line   7: Bid Request Information
2026-01-19 13:27:12,068 - DEBUG -   Line   8: Bid Number: 00358346
2026-01-19 13:27:12,070 - DEBUG -   Line   9: Bid Effective Date: 2025-11-21
2026-01-19 13:27:12,071 - DEBUG -   Line  10: Bid Expiration Date: 2025-12-31
2026-01-19 13:27:12,072 - DEBUG -   Line  11: Date Bid Sent: 2025-11-21
2026-01-19 13:27:12,075 - DEBUG -   Line  12: Distributor Name: Mindware FZ LLC
2026-01-19 13:27:12,075 - DEBUG -   Line  13: Reseller Name: CUBEWISE AFRICA SN SAS
2026-01-19 13:27:12,076 - DEBUG -   Line  14: Business Partner of Record: No
2026-01-19 13:27:12,077 - DEBUG -   Line  15: Opportunity Owner: Ted Ochola
2026-01-19 13:27:12,078 - DEBUG -   Line  16: Currency: USD
2026-01-19 13:27:12,079 - DEBUG -   Line  17: Payment Terms: 30 days
2026-01-19 13:27:12,080 - DEBUG -   Line  18: Site ID:
2026-01-19 13:27:12,080 - DEBUG -   Line  19: MIBB INTERNATIONAL FZ-LLC
2026-01-19 13:27:12,081 - DEBUG -   Line  20: MIBB INTERNATIONAL FZ-LLC
2026-01-19 13:27:12,082 - DEBUG -   Line  21: Office Park Block D
2026-01-19 13:27:12,083 - DEBUG -   Line  22: Dubai Internet City
2026-01-19 13:27:12,086 - DEBUG -   Line  23: Dubai, UAE
2026-01-19 13:27:12,087 - DEBUG -   Line  24: VAT: Reg no :104336463500001
2026-01-19 13:27:12,087 - DEBUG -   Line  25: Page 2 of 5
2026-01-19 13:27:12,087 - DEBUG -   Line  26: Overage Quotation
2026-01-19 13:27:12,088 - DEBUG -   Line  27: #
2026-01-19 13:27:12,089 - DEBUG -   Line  28: Part Number
2026-01-19 13:27:12,089 - DEBUG -   Line  29: Description
2026-01-19 13:27:12,091 - DEBUG -   Line  30: Customer Unit Price
2026-01-19 13:27:12,092 - DEBUG -   Line  31: Quantity
2026-01-19 13:27:12,093 - DEBUG -   Line  32: Quote Rate
2026-01-19 13:27:12,094 - DEBUG -   Line  33: Quote Unit Price
2026-01-19 13:27:12,095 - DEBUG -   Line  34: 1
2026-01-19 13:27:12,096 - DEBUG -   Line  35: D1RJ7LL
2026-01-19 13:27:12,097 - DEBUG -   Line  36: Planning Analytics
2026-01-19 13:27:12,099 - DEBUG -   Line  37: 314.00
2026-01-19 13:27:12,100 - DEBUG -   Line  38: N/A
2026-01-19 13:27:12,101 - DEBUG -   Line  39: 314.00
2026-01-19 13:27:12,101 - DEBUG -   Line  40: 314.00
2026-01-19 13:27:12,102 - DEBUG -   Line  41: 2
2026-01-19 13:27:12,102 - DEBUG -   Line  42: D1RJ9LL
2026-01-19 13:27:12,104 - DEBUG -   Line  43: Planning Analytics
2026-01-19 13:27:12,105 - DEBUG -   Line  44: 209.00
2026-01-19 13:27:12,106 - DEBUG -   Line  45: N/A
2026-01-19 13:27:12,108 - DEBUG -   Line  46: 209.00
2026-01-19 13:27:12,109 - DEBUG -   Line  47: 209.00
2026-01-19 13:27:12,109 - DEBUG -   Line  48: Subscription Quotation
2026-01-19 13:27:12,111 - DEBUG -   Line  49: Parts Information
2026-01-19 13:27:12,112 - DEBUG - 
Parsing header information...
2026-01-19 13:27:12,112 - DEBUG -   [Line 2] Customer Name: 'Address: Botswana'
2026-01-19 13:27:12,112 - DEBUG -   [Line 4] City: 'Country: Botswana'
2026-01-19 13:27:12,113 - DEBUG -   [Line 5] Country: 'Government Entity (GOE): No'
2026-01-19 13:27:12,113 - DEBUG -   [Line 6] Government Entity (GOE): 'Bid Request Information'
2026-01-19 13:27:12,114 - DEBUG -   [Line 8] Bid Number: 'Bid Effective Date: 2025-11-21'
2026-01-19 13:27:12,114 - DEBUG -   [Line 10] Bid Expiration Date: 'Date Bid Sent: 2025-11-21'
2026-01-19 13:27:12,115 - DEBUG -   [Line 13] Reseller Name: 'Business Partner of Record: No'
2026-01-19 13:27:12,116 - DEBUG - 
Header extraction complete: 7 fields found
2026-01-19 13:27:12,116 - DEBUG - 
Extracted header information:
2026-01-19 13:27:12,117 - DEBUG -   Customer Name                      : Address: Botswana
2026-01-19 13:27:12,117 - DEBUG -   Bid Number                         : Bid Effective Date: 2025-11-21
2026-01-19 13:27:12,118 - DEBUG -   PA Agreement Number                : 
2026-01-19 13:27:12,118 - DEBUG -   PA Site Number                     : 
2026-01-19 13:27:12,119 - DEBUG -   Select Territory                   : 
2026-01-19 13:27:12,119 - DEBUG -   Government Entity (GOE)            : Bid Request Information
2026-01-19 13:27:12,119 - DEBUG -   Reseller Name                      : Business Partner of Record: No
2026-01-19 13:27:12,120 - DEBUG -   City                               : Country: Botswana
2026-01-19 13:27:12,120 - DEBUG -   Country                            : Government Entity (GOE): No
2026-01-19 13:27:12,120 - DEBUG -   Maximum End User Price (MEP)       : 
2026-01-19 13:27:12,121 - DEBUG -   Total Value Seller Revenue Opportunity: 
2026-01-19 13:27:12,122 - DEBUG -   Bid Expiration Date                : Date Bid Sent: 2025-11-21
2026-01-19 13:27:12,122 - DEBUG - ================================================================================

2026-01-19 13:27:12,123 - DEBUG - ================================================================================
2026-01-19 13:27:12,123 - DEBUG - MIBB TABLE EXTRACTION STARTED
2026-01-19 13:27:12,124 - DEBUG - ================================================================================
2026-01-19 13:27:12,125 - DEBUG - PDF opened for table extraction: 5 pages
2026-01-19 13:27:12,144 - DEBUG - [PAGE SCAN] Candidate page 2: marker_score=2, header_score=6
2026-01-19 13:27:12,170 - DEBUG - [PAGE SELECT] Using page 2 (marker_score=2, header_score=6)
2026-01-19 13:27:12,171 - DEBUG - 
[STRATEGY 1] Attempting PyMuPDF table detection on page 2...
2026-01-19 13:27:12,499 - DEBUG - [STRATEGY 1 FAILED] PyMuPDF table detection error: object of type 'TableFinder' has no len()
2026-01-19 13:27:12,500 - DEBUG - Falling back to text-based extraction...
2026-01-19 13:27:12,500 - DEBUG - 
[STRATEGY 2] Text-based extraction (fallback) on page 2...
2026-01-19 13:27:12,507 - DEBUG - Extracted 116 lines from page 2 text
2026-01-19 13:27:12,510 - DEBUG - 
First 100 lines of page 2:
2026-01-19 13:27:12,510 - DEBUG -   Line   0: Page 2 of 5
2026-01-19 13:27:12,511 - DEBUG -   Line   1: Overage Quotation
2026-01-19 13:27:12,511 - DEBUG -   Line   2: #
2026-01-19 13:27:12,511 - DEBUG -   Line   3: Part Number
2026-01-19 13:27:12,512 - DEBUG -   Line   4: Description
2026-01-19 13:27:12,514 - DEBUG -   Line   5: Customer Unit Price
2026-01-19 13:27:12,517 - DEBUG -   Line   6: Quantity
2026-01-19 13:27:12,519 - DEBUG -   Line   7: Quote Rate
2026-01-19 13:27:12,527 - DEBUG -   Line   8: Quote Unit Price
2026-01-19 13:27:12,533 - DEBUG -   Line   9: 1
2026-01-19 13:27:12,534 - DEBUG -   Line  10: D1RJ7LL
2026-01-19 13:27:12,535 - DEBUG -   Line  11: Planning Analytics
2026-01-19 13:27:12,536 - DEBUG -   Line  12: 314.00
2026-01-19 13:27:12,537 - DEBUG -   Line  13: N/A
2026-01-19 13:27:12,538 - DEBUG -   Line  14: 314.00
2026-01-19 13:27:12,538 - DEBUG -   Line  15: 314.00
2026-01-19 13:27:12,540 - DEBUG -   Line  16: 2
2026-01-19 13:27:12,540 - DEBUG -   Line  17: D1RJ9LL
2026-01-19 13:27:12,543 - DEBUG -   Line  18: Planning Analytics
2026-01-19 13:27:12,543 - DEBUG -   Line  19: 209.00
2026-01-19 13:27:12,544 - DEBUG -   Line  20: N/A
2026-01-19 13:27:12,544 - DEBUG -   Line  21: 209.00
2026-01-19 13:27:12,544 - DEBUG -   Line  22: 209.00
2026-01-19 13:27:12,544 - DEBUG -   Line  23: Subscription Quotation
2026-01-19 13:27:12,545 - DEBUG -   Line  24: Parts Information
2026-01-19 13:27:12,545 - DEBUG -   Line  25: #
2026-01-19 13:27:12,546 - DEBUG -   Line  26: Part Number
2026-01-19 13:27:12,547 - DEBUG -   Line  27: Description
2026-01-19 13:27:12,547 - DEBUG -   Line  28: Transaction Type
2026-01-19 13:27:12,548 - DEBUG -   Line  29: Billing
2026-01-19 13:27:12,548 - DEBUG -   Line  30: Points
2026-01-19 13:27:12,549 - DEBUG -   Line  31: Coverage Start
2026-01-19 13:27:12,549 - DEBUG -   Line  32: Coverage End
2026-01-19 13:27:12,549 - DEBUG -   Line  33: Quantity
2026-01-19 13:27:12,549 - DEBUG -   Line  34: Entitled Unit Entitled Extended
2026-01-19 13:27:12,550 - DEBUG -   Line  35: Discount%
2026-01-19 13:27:12,550 - DEBUG -   Line  36: Bid Unit SVP Bid Ext SVP
2026-01-19 13:27:12,551 - DEBUG -   Line  37: Channel
2026-01-19 13:27:12,551 - DEBUG -   Line  38: Margin
2026-01-19 13:27:12,551 - DEBUG -   Line  39: 1
2026-01-19 13:27:12,552 - DEBUG -   Line  40: D11C4LL
2026-01-19 13:27:12,553 - DEBUG -   Line  41: Planning Analytics
2026-01-19 13:27:12,553 - DEBUG -   Line  42: New
2026-01-19 13:27:12,554 - DEBUG -   Line  43: Upfront
2026-01-19 13:27:12,554 - DEBUG -   Line  44: 06/11/2025
2026-01-19 13:27:12,555 - DEBUG -   Line  45: 30/11/2028
2026-01-19 13:27:12,556 - DEBUG -   Line  46: 1.00
2026-01-19 13:27:12,556 - DEBUG -   Line  47: 0.00
2026-01-19 13:27:12,557 - DEBUG -   Line  48: 0.00
2026-01-19 13:27:12,558 - DEBUG -   Line  49: 0.00
2026-01-19 13:27:12,559 - DEBUG -   Line  50: 0.00
2026-01-19 13:27:12,560 - DEBUG -   Line  51: 0.00
2026-01-19 13:27:12,561 - DEBUG -   Line  52: 8.00
2026-01-19 13:27:12,561 - DEBUG -   Line  53: 2
2026-01-19 13:27:12,562 - DEBUG -   Line  54: D1RJ6LL
2026-01-19 13:27:12,563 - DEBUG -   Line  55: Planning Analytics
2026-01-19 13:27:12,563 - DEBUG -   Line  56: New
2026-01-19 13:27:12,563 - DEBUG -   Line  57: Annual
2026-01-19 13:27:12,564 - DEBUG -   Line  58: 06/11/2025
2026-01-19 13:27:12,564 - DEBUG -   Line  59: 30/11/2028
2026-01-19 13:27:12,565 - DEBUG -   Line  60: 2.00
2026-01-19 13:27:12,565 - DEBUG -   Line  61: 8,676.00
2026-01-19 13:27:12,565 - DEBUG -   Line  62: 17,352.00
2026-01-19 13:27:12,565 - DEBUG -   Line  63: 44.24
2026-01-19 13:27:12,566 - DEBUG -   Line  64: 4,837.51
2026-01-19 13:27:12,566 - DEBUG -   Line  65: 9,675.02
2026-01-19 13:27:12,567 - DEBUG -   Line  66: 8.00
2026-01-19 13:27:12,567 - DEBUG -   Line  67: 3
2026-01-19 13:27:12,567 - DEBUG -   Line  68: D1RJ8LL
2026-01-19 13:27:12,568 - DEBUG -   Line  69: Planning Analytics
2026-01-19 13:27:12,569 - DEBUG -   Line  70: New
2026-01-19 13:27:12,570 - DEBUG -   Line  71: Annual
2026-01-19 13:27:12,570 - DEBUG -   Line  72: 06/11/2025
2026-01-19 13:27:12,572 - DEBUG -   Line  73: 30/11/2028
2026-01-19 13:27:12,572 - DEBUG -   Line  74: 48.00
2026-01-19 13:27:12,573 - DEBUG -   Line  75: 5,796.00
2026-01-19 13:27:12,573 - DEBUG -   Line  76: 278,208.00
2026-01-19 13:27:12,573 - DEBUG -   Line  77: 44.24
2026-01-19 13:27:12,573 - DEBUG -   Line  78: 3,231.70
2026-01-19 13:27:12,574 - DEBUG -   Line  79: 155,121.60
2026-01-19 13:27:12,575 - DEBUG -   Line  80: 8.00
2026-01-19 13:27:12,576 - DEBUG -   Line  81: 4
2026-01-19 13:27:12,576 - DEBUG -   Line  82: D0LW2ZX
2026-01-19 13:27:12,578 - DEBUG -   Line  83: Planning Analytics
2026-01-19 13:27:12,579 - DEBUG -   Line  84: New
2026-01-19 13:27:12,579 - DEBUG -   Line  85: Annual
2026-01-19 13:27:12,580 - DEBUG -   Line  86: 06/11/2025
2026-01-19 13:27:12,580 - DEBUG -   Line  87: 30/11/2028
2026-01-19 13:27:12,581 - DEBUG -   Line  88: 5.00
2026-01-19 13:27:12,581 - DEBUG -   Line  89: 1,155.60
2026-01-19 13:27:12,581 - DEBUG -   Line  90: 5,778.00
2026-01-19 13:27:12,586 - DEBUG -   Line  91: 44.24
2026-01-19 13:27:12,589 - DEBUG -   Line  92: 644.34
2026-01-19 13:27:12,591 - DEBUG -   Line  93: 3,221.70
2026-01-19 13:27:12,594 - DEBUG -   Line  94: 8.00
2026-01-19 13:27:12,595 - DEBUG -   Line  95: 5
2026-01-19 13:27:12,596 - DEBUG -   Line  96: D22RMLL
2026-01-19 13:27:12,596 - DEBUG -   Line  97: Planning Analytics
2026-01-19 13:27:12,597 - DEBUG -   Line  98: New
2026-01-19 13:27:12,597 - DEBUG -   Line  99: Annual
2026-01-19 13:27:12,598 - DEBUG - 
Searching for table start marker...
2026-01-19 13:27:12,598 - DEBUG -   Found table start at line 23: 'Subscription Quotation'
2026-01-19 13:27:12,598 - DEBUG - 
Searching for header line...
2026-01-19 13:27:12,599 - DEBUG -   Found header anchor at line 26: 'Part Number'
2026-01-19 13:27:12,599 - DEBUG - 
Extracting data rows starting from line 27:
2026-01-19 13:27:12,600 - DEBUG - 
  Row 1 (line 40):
2026-01-19 13:27:12,602 - DEBUG -     Raw line: 'D11C4LL'
2026-01-19 13:27:12,602 - DEBUG -     Part Number found: 'D11C4LL'
2026-01-19 13:27:12,603 - DEBUG -     Description: 'Planning Analytics...'
2026-01-19 13:27:12,603 - DEBUG -     Found dates at line 44: ['06/11/2025']
2026-01-19 13:27:12,603 - DEBUG -     Found dates at line 45: ['30/11/2028']
2026-01-19 13:27:12,604 - DEBUG -     Dates found: Start='06/11/2025', End='30/11/2028'
2026-01-19 13:27:12,605 - DEBUG -     Quantity found at line 46: 1
2026-01-19 13:27:12,606 - DEBUG -     Found discount at line 46: 1.0%
2026-01-19 13:27:12,606 - DEBUG -     Found discount at line 52: 8.0%
2026-01-19 13:27:12,607 - DEBUG -     Found discount at line 60: 2.0%
2026-01-19 13:27:12,609 - DEBUG -     Price after discount at line 61: 8676.0
2026-01-19 13:27:12,613 - DEBUG -     Price after discount at line 62: 17352.0
2026-01-19 13:27:12,615 - DEBUG -     Selected Bid Ext SVP (2nd price after discount): 17352.0 (from line 62)
2026-01-19 13:27:12,616 - DEBUG -     Final: Part=D11C4LL, Desc=Planning Analytics, Start=06/11/2025, End=30/11/2028, Qty=1, Price=17352.0
2026-01-19 13:27:12,617 - DEBUG -     ✓ Row added successfully
2026-01-19 13:27:12,618 - DEBUG - 
  Row 2 (line 54):
2026-01-19 13:27:12,619 - DEBUG -     Raw line: 'D1RJ6LL'
2026-01-19 13:27:12,619 - DEBUG -     Part Number found: 'D1RJ6LL'
2026-01-19 13:27:12,619 - DEBUG -     Description: 'Planning Analytics...'
2026-01-19 13:27:12,620 - DEBUG -     Found dates at line 58: ['06/11/2025']
2026-01-19 13:27:12,620 - DEBUG -     Found dates at line 59: ['30/11/2028']
2026-01-19 13:27:12,621 - DEBUG -     Dates found: Start='06/11/2025', End='30/11/2028'
2026-01-19 13:27:12,621 - DEBUG -     Quantity found at line 60: 2
2026-01-19 13:27:12,621 - DEBUG -     Found discount at line 60: 2.0%
2026-01-19 13:27:12,621 - DEBUG -     Price after discount at line 61: 8676.0
2026-01-19 13:27:12,622 - DEBUG -     Price after discount at line 62: 17352.0
2026-01-19 13:27:12,622 - DEBUG -     Selected Bid Ext SVP (2nd price after discount): 17352.0 (from line 62)
2026-01-19 13:27:12,622 - DEBUG -     Final: Part=D1RJ6LL, Desc=Planning Analytics, Start=06/11/2025, End=30/11/2028, Qty=2, Price=17352.0
2026-01-19 13:27:12,622 - DEBUG -     ✓ Row added successfully
2026-01-19 13:27:12,623 - DEBUG - 
  Row 3 (line 68):
2026-01-19 13:27:12,623 - DEBUG -     Raw line: 'D1RJ8LL'
2026-01-19 13:27:12,630 - DEBUG -     Part Number found: 'D1RJ8LL'
2026-01-19 13:27:12,631 - DEBUG -     Description: 'Planning Analytics...'
2026-01-19 13:27:12,632 - DEBUG -     Found dates at line 72: ['06/11/2025']
2026-01-19 13:27:12,632 - DEBUG -     Found dates at line 73: ['30/11/2028']
2026-01-19 13:27:12,633 - DEBUG -     Dates found: Start='06/11/2025', End='30/11/2028'
2026-01-19 13:27:12,633 - DEBUG -     Quantity found at line 74: 48
2026-01-19 13:27:12,634 - DEBUG -     Found discount at line 74: 48.0%
2026-01-19 13:27:12,634 - DEBUG -     Price after discount at line 75: 5796.0
2026-01-19 13:27:12,634 - DEBUG -     Price after discount at line 76: 278208.0
2026-01-19 13:27:12,635 - DEBUG -     Selected Bid Ext SVP (2nd price after discount): 278208.0 (from line 76)
2026-01-19 13:27:12,635 - DEBUG -     Final: Part=D1RJ8LL, Desc=Planning Analytics, Start=06/11/2025, End=30/11/2028, Qty=48, Price=278208.0
2026-01-19 13:27:12,636 - DEBUG -     ✓ Row added successfully
2026-01-19 13:27:12,636 - DEBUG - 
  Row 4 (line 82):
2026-01-19 13:27:12,636 - DEBUG -     Raw line: 'D0LW2ZX'
2026-01-19 13:27:12,637 - DEBUG -     Part Number found: 'D0LW2ZX'
2026-01-19 13:27:12,637 - DEBUG -     Description: 'Planning Analytics...'
2026-01-19 13:27:12,637 - DEBUG -     Found dates at line 86: ['06/11/2025']
2026-01-19 13:27:12,637 - DEBUG -     Found dates at line 87: ['30/11/2028']
2026-01-19 13:27:12,638 - DEBUG -     Dates found: Start='06/11/2025', End='30/11/2028'
2026-01-19 13:27:12,638 - DEBUG -     Quantity found at line 88: 5
2026-01-19 13:27:12,639 - DEBUG -     Found discount at line 88: 5.0%
2026-01-19 13:27:12,639 - DEBUG -     Price after discount at line 89: 1155.6
2026-01-19 13:27:12,639 - DEBUG -     Price after discount at line 90: 5778.0
2026-01-19 13:27:12,640 - DEBUG -     Selected Bid Ext SVP (2nd price after discount): 5778.0 (from line 90)
2026-01-19 13:27:12,646 - DEBUG -     Final: Part=D0LW2ZX, Desc=Planning Analytics, Start=06/11/2025, End=30/11/2028, Qty=5, Price=5778.0
2026-01-19 13:27:12,646 - DEBUG -     ✓ Row added successfully
2026-01-19 13:27:12,647 - DEBUG - 
  Row 5 (line 96):
2026-01-19 13:27:12,649 - DEBUG -     Raw line: 'D22RMLL'
2026-01-19 13:27:12,649 - DEBUG -     Part Number found: 'D22RMLL'
2026-01-19 13:27:12,649 - DEBUG -     Description: 'Planning Analytics...'
2026-01-19 13:27:12,650 - DEBUG -     Found dates at line 100: ['06/11/2025']
2026-01-19 13:27:12,651 - DEBUG -     Found dates at line 101: ['30/11/2028']
2026-01-19 13:27:12,651 - DEBUG -     Dates found: Start='06/11/2025', End='30/11/2028'
2026-01-19 13:27:12,651 - DEBUG -     Quantity found at line 102: 1
2026-01-19 13:27:12,652 - DEBUG -     Found discount at line 102: 1.0%
2026-01-19 13:27:12,653 - DEBUG -     Price after discount at line 103: 19260.0
2026-01-19 13:27:12,654 - DEBUG -     Price after discount at line 104: 19260.0
2026-01-19 13:27:12,654 - DEBUG -     Selected Bid Ext SVP (2nd price after discount): 19260.0 (from line 104)
2026-01-19 13:27:12,655 - DEBUG -     Final: Part=D22RMLL, Desc=Planning Analytics, Start=06/11/2025, End=30/11/2028, Qty=1, Price=19260.0
2026-01-19 13:27:12,655 - DEBUG -     ✓ Row added successfully
2026-01-19 13:27:12,656 - DEBUG - 
[STRATEGY 2 COMPLETE] Extracted 5 rows using text-based extraction
2026-01-19 13:27:12,657 - DEBUG - 
Final extracted data summary:
2026-01-19 13:27:12,664 - DEBUG -   Row 1: Part=D11C4LL, Qty=1, Price=17352.0
2026-01-19 13:27:12,664 - DEBUG -   Row 2: Part=D1RJ6LL, Qty=2, Price=17352.0
2026-01-19 13:27:12,665 - DEBUG -   Row 3: Part=D1RJ8LL, Qty=48, Price=278208.0
2026-01-19 13:27:12,665 - DEBUG -   Row 4: Part=D0LW2ZX, Qty=5, Price=5778.0
2026-01-19 13:27:12,666 - DEBUG -   Row 5: Part=D22RMLL, Qty=1, Price=19260.0
2026-01-19 13:27:12,666 - DEBUG - ================================================================================

2026-01-19 13:27:18,683 - DEBUG - ================================================================================
2026-01-19 13:27:18,685 - DEBUG - MIBB HEADER EXTRACTION STARTED
2026-01-19 13:27:18,686 - DEBUG - ================================================================================
2026-01-19 13:27:18,688 - DEBUG - PDF opened successfully: 5 pages
2026-01-19 13:27:18,700 - DEBUG - Page 1: Extracted 25 lines
2026-01-19 13:27:18,713 - DEBUG - Page 2: Extracted 116 lines
2026-01-19 13:27:18,720 - DEBUG - Page 3: Extracted 102 lines
2026-01-19 13:27:18,730 - DEBUG - Page 4: Extracted 33 lines
2026-01-19 13:27:18,745 - DEBUG - Page 5: Extracted 36 lines
2026-01-19 13:27:18,745 - DEBUG - Total lines extracted: 312
2026-01-19 13:27:18,746 - DEBUG - 
First 50 lines of PDF:
2026-01-19 13:27:18,747 - DEBUG -   Line   0: Page 1 of 5
2026-01-19 13:27:18,748 - DEBUG -   Line   1: Customer Information
2026-01-19 13:27:18,749 - DEBUG -   Line   2: Customer Name: Orange Botswana [Pty] Ltd
2026-01-19 13:27:18,750 - DEBUG -   Line   3: Address: Botswana
2026-01-19 13:27:18,750 - DEBUG -   Line   4: City: Gaborone
2026-01-19 13:27:18,751 - DEBUG -   Line   5: Country: Botswana
2026-01-19 13:27:18,752 - DEBUG -   Line   6: Government Entity (GOE): No
2026-01-19 13:27:18,753 - DEBUG -   Line   7: Bid Request Information
2026-01-19 13:27:18,756 - DEBUG -   Line   8: Bid Number: 00358346
2026-01-19 13:27:18,758 - DEBUG -   Line   9: Bid Effective Date: 2025-11-21
2026-01-19 13:27:18,759 - DEBUG -   Line  10: Bid Expiration Date: 2025-12-31
2026-01-19 13:27:18,760 - DEBUG -   Line  11: Date Bid Sent: 2025-11-21
2026-01-19 13:27:18,766 - DEBUG -   Line  12: Distributor Name: Mindware FZ LLC
2026-01-19 13:27:18,782 - DEBUG -   Line  13: Reseller Name: CUBEWISE AFRICA SN SAS
2026-01-19 13:27:18,790 - DEBUG -   Line  14: Business Partner of Record: No
2026-01-19 13:27:18,797 - DEBUG -   Line  15: Opportunity Owner: Ted Ochola
2026-01-19 13:27:18,800 - DEBUG -   Line  16: Currency: USD
2026-01-19 13:27:18,801 - DEBUG -   Line  17: Payment Terms: 30 days
2026-01-19 13:27:18,806 - DEBUG -   Line  18: Site ID:
2026-01-19 13:27:18,819 - DEBUG -   Line  19: MIBB INTERNATIONAL FZ-LLC
2026-01-19 13:27:18,821 - DEBUG -   Line  20: MIBB INTERNATIONAL FZ-LLC
2026-01-19 13:27:18,825 - DEBUG -   Line  21: Office Park Block D
2026-01-19 13:27:18,829 - DEBUG -   Line  22: Dubai Internet City
2026-01-19 13:27:18,832 - DEBUG -   Line  23: Dubai, UAE
2026-01-19 13:27:18,834 - DEBUG -   Line  24: VAT: Reg no :104336463500001
2026-01-19 13:27:18,839 - DEBUG -   Line  25: Page 2 of 5
2026-01-19 13:27:18,845 - DEBUG -   Line  26: Overage Quotation
2026-01-19 13:27:18,848 - DEBUG -   Line  27: #
2026-01-19 13:27:18,861 - DEBUG -   Line  28: Part Number
2026-01-19 13:27:18,864 - DEBUG -   Line  29: Description
2026-01-19 13:27:18,865 - DEBUG -   Line  30: Customer Unit Price
2026-01-19 13:27:18,866 - DEBUG -   Line  31: Quantity
2026-01-19 13:27:18,866 - DEBUG -   Line  32: Quote Rate
2026-01-19 13:27:18,866 - DEBUG -   Line  33: Quote Unit Price
2026-01-19 13:27:18,866 - DEBUG -   Line  34: 1
2026-01-19 13:27:18,868 - DEBUG -   Line  35: D1RJ7LL
2026-01-19 13:27:18,869 - DEBUG -   Line  36: Planning Analytics
2026-01-19 13:27:18,869 - DEBUG -   Line  37: 314.00
2026-01-19 13:27:18,869 - DEBUG -   Line  38: N/A
2026-01-19 13:27:18,869 - DEBUG -   Line  39: 314.00
2026-01-19 13:27:18,870 - DEBUG -   Line  40: 314.00
2026-01-19 13:27:18,871 - DEBUG -   Line  41: 2
2026-01-19 13:27:18,871 - DEBUG -   Line  42: D1RJ9LL
2026-01-19 13:27:18,872 - DEBUG -   Line  43: Planning Analytics
2026-01-19 13:27:18,872 - DEBUG -   Line  44: 209.00
2026-01-19 13:27:18,873 - DEBUG -   Line  45: N/A
2026-01-19 13:27:18,873 - DEBUG -   Line  46: 209.00
2026-01-19 13:27:18,873 - DEBUG -   Line  47: 209.00
2026-01-19 13:27:18,873 - DEBUG -   Line  48: Subscription Quotation
2026-01-19 13:27:18,877 - DEBUG -   Line  49: Parts Information
2026-01-19 13:27:18,878 - DEBUG - 
Parsing header information...
2026-01-19 13:27:18,878 - DEBUG -   [Line 2] Customer Name: 'Address: Botswana'
2026-01-19 13:27:18,878 - DEBUG -   [Line 4] City: 'Country: Botswana'
2026-01-19 13:27:18,878 - DEBUG -   [Line 5] Country: 'Government Entity (GOE): No'
2026-01-19 13:27:18,879 - DEBUG -   [Line 6] Government Entity (GOE): 'Bid Request Information'
2026-01-19 13:27:18,879 - DEBUG -   [Line 8] Bid Number: 'Bid Effective Date: 2025-11-21'
2026-01-19 13:27:18,880 - DEBUG -   [Line 10] Bid Expiration Date: 'Date Bid Sent: 2025-11-21'
2026-01-19 13:27:18,881 - DEBUG -   [Line 13] Reseller Name: 'Business Partner of Record: No'
2026-01-19 13:27:18,881 - DEBUG - 
Header extraction complete: 7 fields found
2026-01-19 13:27:18,882 - DEBUG - 
Extracted header information:
2026-01-19 13:27:18,882 - DEBUG -   Customer Name                      : Address: Botswana
2026-01-19 13:27:18,883 - DEBUG -   Bid Number                         : Bid Effective Date: 2025-11-21
2026-01-19 13:27:18,883 - DEBUG -   PA Agreement Number                : 
2026-01-19 13:27:18,883 - DEBUG -   PA Site Number                     : 
2026-01-19 13:27:18,883 - DEBUG -   Select Territory                   : 
2026-01-19 13:27:18,883 - DEBUG -   Government Entity (GOE)            : Bid Request Information
2026-01-19 13:27:18,884 - DEBUG -   Reseller Name                      : Business Partner of Record: No
2026-01-19 13:27:18,884 - DEBUG -   City                               : Country: Botswana
2026-01-19 13:27:18,885 - DEBUG -   Country                            : Government Entity (GOE): No
2026-01-19 13:27:18,885 - DEBUG -   Maximum End User Price (MEP)       : 
2026-01-19 13:27:18,886 - DEBUG -   Total Value Seller Revenue Opportunity: 
2026-01-19 13:27:18,887 - DEBUG -   Bid Expiration Date                : Date Bid Sent: 2025-11-21
2026-01-19 13:27:18,889 - DEBUG - ================================================================================

2026-01-19 13:27:18,890 - DEBUG - ================================================================================
2026-01-19 13:27:18,890 - DEBUG - MIBB TABLE EXTRACTION STARTED
2026-01-19 13:27:18,891 - DEBUG - ================================================================================
2026-01-19 13:27:18,896 - DEBUG - PDF opened for table extraction: 5 pages
2026-01-19 13:27:18,905 - DEBUG - [PAGE SCAN] Candidate page 2: marker_score=2, header_score=6
2026-01-19 13:27:18,939 - DEBUG - [PAGE SELECT] Using page 2 (marker_score=2, header_score=6)
2026-01-19 13:27:18,940 - DEBUG - 
[STRATEGY 1] Attempting PyMuPDF table detection on page 2...
2026-01-19 13:27:19,288 - DEBUG - [STRATEGY 1 FAILED] PyMuPDF table detection error: object of type 'TableFinder' has no len()
2026-01-19 13:27:19,288 - DEBUG - Falling back to text-based extraction...
2026-01-19 13:27:19,288 - DEBUG - 
[STRATEGY 2] Text-based extraction (fallback) on page 2...
2026-01-19 13:27:19,294 - DEBUG - Extracted 116 lines from page 2 text
2026-01-19 13:27:19,294 - DEBUG - 
First 100 lines of page 2:
2026-01-19 13:27:19,295 - DEBUG -   Line   0: Page 2 of 5
2026-01-19 13:27:19,295 - DEBUG -   Line   1: Overage Quotation
2026-01-19 13:27:19,296 - DEBUG -   Line   2: #
2026-01-19 13:27:19,296 - DEBUG -   Line   3: Part Number
2026-01-19 13:27:19,296 - DEBUG -   Line   4: Description
2026-01-19 13:27:19,296 - DEBUG -   Line   5: Customer Unit Price
2026-01-19 13:27:19,297 - DEBUG -   Line   6: Quantity
2026-01-19 13:27:19,297 - DEBUG -   Line   7: Quote Rate
2026-01-19 13:27:19,297 - DEBUG -   Line   8: Quote Unit Price
2026-01-19 13:27:19,298 - DEBUG -   Line   9: 1
2026-01-19 13:27:19,298 - DEBUG -   Line  10: D1RJ7LL
2026-01-19 13:27:19,299 - DEBUG -   Line  11: Planning Analytics
2026-01-19 13:27:19,299 - DEBUG -   Line  12: 314.00
2026-01-19 13:27:19,299 - DEBUG -   Line  13: N/A
2026-01-19 13:27:19,299 - DEBUG -   Line  14: 314.00
2026-01-19 13:27:19,299 - DEBUG -   Line  15: 314.00
2026-01-19 13:27:19,299 - DEBUG -   Line  16: 2
2026-01-19 13:27:19,301 - DEBUG -   Line  17: D1RJ9LL
2026-01-19 13:27:19,301 - DEBUG -   Line  18: Planning Analytics
2026-01-19 13:27:19,301 - DEBUG -   Line  19: 209.00
2026-01-19 13:27:19,302 - DEBUG -   Line  20: N/A
2026-01-19 13:27:19,302 - DEBUG -   Line  21: 209.00
2026-01-19 13:27:19,302 - DEBUG -   Line  22: 209.00
2026-01-19 13:27:19,302 - DEBUG -   Line  23: Subscription Quotation
2026-01-19 13:27:19,304 - DEBUG -   Line  24: Parts Information
2026-01-19 13:27:19,305 - DEBUG -   Line  25: #
2026-01-19 13:27:19,305 - DEBUG -   Line  26: Part Number
2026-01-19 13:27:19,305 - DEBUG -   Line  27: Description
2026-01-19 13:27:19,306 - DEBUG -   Line  28: Transaction Type
2026-01-19 13:27:19,306 - DEBUG -   Line  29: Billing
2026-01-19 13:27:19,306 - DEBUG -   Line  30: Points
2026-01-19 13:27:19,306 - DEBUG -   Line  31: Coverage Start
2026-01-19 13:27:19,307 - DEBUG -   Line  32: Coverage End
2026-01-19 13:27:19,307 - DEBUG -   Line  33: Quantity
2026-01-19 13:27:19,307 - DEBUG -   Line  34: Entitled Unit Entitled Extended
2026-01-19 13:27:19,307 - DEBUG -   Line  35: Discount%
2026-01-19 13:27:19,308 - DEBUG -   Line  36: Bid Unit SVP Bid Ext SVP
2026-01-19 13:27:19,310 - DEBUG -   Line  37: Channel
2026-01-19 13:27:19,311 - DEBUG -   Line  38: Margin
2026-01-19 13:27:19,311 - DEBUG -   Line  39: 1
2026-01-19 13:27:19,312 - DEBUG -   Line  40: D11C4LL
2026-01-19 13:27:19,312 - DEBUG -   Line  41: Planning Analytics
2026-01-19 13:27:19,312 - DEBUG -   Line  42: New
2026-01-19 13:27:19,313 - DEBUG -   Line  43: Upfront
2026-01-19 13:27:19,313 - DEBUG -   Line  44: 06/11/2025
2026-01-19 13:27:19,313 - DEBUG -   Line  45: 30/11/2028
2026-01-19 13:27:19,314 - DEBUG -   Line  46: 1.00
2026-01-19 13:27:19,314 - DEBUG -   Line  47: 0.00
2026-01-19 13:27:19,314 - DEBUG -   Line  48: 0.00
2026-01-19 13:27:19,315 - DEBUG -   Line  49: 0.00
2026-01-19 13:27:19,315 - DEBUG -   Line  50: 0.00
2026-01-19 13:27:19,315 - DEBUG -   Line  51: 0.00
2026-01-19 13:27:19,315 - DEBUG -   Line  52: 8.00
2026-01-19 13:27:19,316 - DEBUG -   Line  53: 2
2026-01-19 13:27:19,316 - DEBUG -   Line  54: D1RJ6LL
2026-01-19 13:27:19,316 - DEBUG -   Line  55: Planning Analytics
2026-01-19 13:27:19,316 - DEBUG -   Line  56: New
2026-01-19 13:27:19,317 - DEBUG -   Line  57: Annual
2026-01-19 13:27:19,317 - DEBUG -   Line  58: 06/11/2025
2026-01-19 13:27:19,318 - DEBUG -   Line  59: 30/11/2028
2026-01-19 13:27:19,318 - DEBUG -   Line  60: 2.00
2026-01-19 13:27:19,318 - DEBUG -   Line  61: 8,676.00
2026-01-19 13:27:19,319 - DEBUG -   Line  62: 17,352.00
2026-01-19 13:27:19,319 - DEBUG -   Line  63: 44.24
2026-01-19 13:27:19,320 - DEBUG -   Line  64: 4,837.51
2026-01-19 13:27:19,320 - DEBUG -   Line  65: 9,675.02
2026-01-19 13:27:19,320 - DEBUG -   Line  66: 8.00
2026-01-19 13:27:19,321 - DEBUG -   Line  67: 3
2026-01-19 13:27:19,321 - DEBUG -   Line  68: D1RJ8LL
2026-01-19 13:27:19,321 - DEBUG -   Line  69: Planning Analytics
2026-01-19 13:27:19,322 - DEBUG -   Line  70: New
2026-01-19 13:27:19,322 - DEBUG -   Line  71: Annual
2026-01-19 13:27:19,322 - DEBUG -   Line  72: 06/11/2025
2026-01-19 13:27:19,323 - DEBUG -   Line  73: 30/11/2028
2026-01-19 13:27:19,323 - DEBUG -   Line  74: 48.00
2026-01-19 13:27:19,323 - DEBUG -   Line  75: 5,796.00
2026-01-19 13:27:19,325 - DEBUG -   Line  76: 278,208.00
2026-01-19 13:27:19,325 - DEBUG -   Line  77: 44.24
2026-01-19 13:27:19,326 - DEBUG -   Line  78: 3,231.70
2026-01-19 13:27:19,327 - DEBUG -   Line  79: 155,121.60
2026-01-19 13:27:19,328 - DEBUG -   Line  80: 8.00
2026-01-19 13:27:19,328 - DEBUG -   Line  81: 4
2026-01-19 13:27:19,328 - DEBUG -   Line  82: D0LW2ZX
2026-01-19 13:27:19,328 - DEBUG -   Line  83: Planning Analytics
2026-01-19 13:27:19,329 - DEBUG -   Line  84: New
2026-01-19 13:27:19,329 - DEBUG -   Line  85: Annual
2026-01-19 13:27:19,329 - DEBUG -   Line  86: 06/11/2025
2026-01-19 13:27:19,329 - DEBUG -   Line  87: 30/11/2028
2026-01-19 13:27:19,330 - DEBUG -   Line  88: 5.00
2026-01-19 13:27:19,330 - DEBUG -   Line  89: 1,155.60
2026-01-19 13:27:19,330 - DEBUG -   Line  90: 5,778.00
2026-01-19 13:27:19,330 - DEBUG -   Line  91: 44.24
2026-01-19 13:27:19,331 - DEBUG -   Line  92: 644.34
2026-01-19 13:27:19,331 - DEBUG -   Line  93: 3,221.70
2026-01-19 13:27:19,331 - DEBUG -   Line  94: 8.00
2026-01-19 13:27:19,331 - DEBUG -   Line  95: 5
2026-01-19 13:27:19,332 - DEBUG -   Line  96: D22RMLL
2026-01-19 13:27:19,332 - DEBUG -   Line  97: Planning Analytics
2026-01-19 13:27:19,333 - DEBUG -   Line  98: New
2026-01-19 13:27:19,333 - DEBUG -   Line  99: Annual
2026-01-19 13:27:19,333 - DEBUG - 
Searching for table start marker...
2026-01-19 13:27:19,334 - DEBUG -   Found table start at line 23: 'Subscription Quotation'
2026-01-19 13:27:19,334 - DEBUG - 
Searching for header line...
2026-01-19 13:27:19,335 - DEBUG -   Found header anchor at line 26: 'Part Number'
2026-01-19 13:27:19,335 - DEBUG - 
Extracting data rows starting from line 27:
2026-01-19 13:27:19,336 - DEBUG - 
  Row 1 (line 40):
2026-01-19 13:27:19,337 - DEBUG -     Raw line: 'D11C4LL'
2026-01-19 13:27:19,337 - DEBUG -     Part Number found: 'D11C4LL'
2026-01-19 13:27:19,337 - DEBUG -     Description: 'Planning Analytics...'
2026-01-19 13:27:19,338 - DEBUG -     Found dates at line 44: ['06/11/2025']
2026-01-19 13:27:19,338 - DEBUG -     Found dates at line 45: ['30/11/2028']
2026-01-19 13:27:19,339 - DEBUG -     Dates found: Start='06/11/2025', End='30/11/2028'
2026-01-19 13:27:19,339 - DEBUG -     Quantity found at line 46: 1
2026-01-19 13:27:19,340 - DEBUG -     Found discount at line 46: 1.0%
2026-01-19 13:27:19,340 - DEBUG -     Found discount at line 52: 8.0%
2026-01-19 13:27:19,341 - DEBUG -     Found discount at line 60: 2.0%
2026-01-19 13:27:19,342 - DEBUG -     Price after discount at line 61: 8676.0
2026-01-19 13:27:19,342 - DEBUG -     Price after discount at line 62: 17352.0
2026-01-19 13:27:19,344 - DEBUG -     Selected Bid Ext SVP (2nd price after discount): 17352.0 (from line 62)
2026-01-19 13:27:19,344 - DEBUG -     Final: Part=D11C4LL, Desc=Planning Analytics, Start=06/11/2025, End=30/11/2028, Qty=1, Price=17352.0
2026-01-19 13:27:19,345 - DEBUG -     ✓ Row added successfully
2026-01-19 13:27:19,345 - DEBUG - 
  Row 2 (line 54):
2026-01-19 13:27:19,345 - DEBUG -     Raw line: 'D1RJ6LL'
2026-01-19 13:27:19,345 - DEBUG -     Part Number found: 'D1RJ6LL'
2026-01-19 13:27:19,346 - DEBUG -     Description: 'Planning Analytics...'
2026-01-19 13:27:19,346 - DEBUG -     Found dates at line 58: ['06/11/2025']
2026-01-19 13:27:19,346 - DEBUG -     Found dates at line 59: ['30/11/2028']
2026-01-19 13:27:19,347 - DEBUG -     Dates found: Start='06/11/2025', End='30/11/2028'
2026-01-19 13:27:19,347 - DEBUG -     Quantity found at line 60: 2
2026-01-19 13:27:19,347 - DEBUG -     Found discount at line 60: 2.0%
2026-01-19 13:27:19,348 - DEBUG -     Price after discount at line 61: 8676.0
2026-01-19 13:27:19,348 - DEBUG -     Price after discount at line 62: 17352.0
2026-01-19 13:27:19,348 - DEBUG -     Selected Bid Ext SVP (2nd price after discount): 17352.0 (from line 62)
2026-01-19 13:27:19,349 - DEBUG -     Final: Part=D1RJ6LL, Desc=Planning Analytics, Start=06/11/2025, End=30/11/2028, Qty=2, Price=17352.0
2026-01-19 13:27:19,349 - DEBUG -     ✓ Row added successfully
2026-01-19 13:27:19,349 - DEBUG - 
  Row 3 (line 68):
2026-01-19 13:27:19,350 - DEBUG -     Raw line: 'D1RJ8LL'
2026-01-19 13:27:19,350 - DEBUG -     Part Number found: 'D1RJ8LL'
2026-01-19 13:27:19,351 - DEBUG -     Description: 'Planning Analytics...'
2026-01-19 13:27:19,351 - DEBUG -     Found dates at line 72: ['06/11/2025']
2026-01-19 13:27:19,351 - DEBUG -     Found dates at line 73: ['30/11/2028']
2026-01-19 13:27:19,352 - DEBUG -     Dates found: Start='06/11/2025', End='30/11/2028'
2026-01-19 13:27:19,352 - DEBUG -     Quantity found at line 74: 48
2026-01-19 13:27:19,352 - DEBUG -     Found discount at line 74: 48.0%
2026-01-19 13:27:19,353 - DEBUG -     Price after discount at line 75: 5796.0
2026-01-19 13:27:19,353 - DEBUG -     Price after discount at line 76: 278208.0
2026-01-19 13:27:19,354 - DEBUG -     Selected Bid Ext SVP (2nd price after discount): 278208.0 (from line 76)
2026-01-19 13:27:19,354 - DEBUG -     Final: Part=D1RJ8LL, Desc=Planning Analytics, Start=06/11/2025, End=30/11/2028, Qty=48, Price=278208.0
2026-01-19 13:27:19,354 - DEBUG -     ✓ Row added successfully
2026-01-19 13:27:19,354 - DEBUG - 
  Row 4 (line 82):
2026-01-19 13:27:19,355 - DEBUG -     Raw line: 'D0LW2ZX'
2026-01-19 13:27:19,355 - DEBUG -     Part Number found: 'D0LW2ZX'
2026-01-19 13:27:19,356 - DEBUG -     Description: 'Planning Analytics...'
2026-01-19 13:27:19,356 - DEBUG -     Found dates at line 86: ['06/11/2025']
2026-01-19 13:27:19,356 - DEBUG -     Found dates at line 87: ['30/11/2028']
2026-01-19 13:27:19,357 - DEBUG -     Dates found: Start='06/11/2025', End='30/11/2028'
2026-01-19 13:27:19,358 - DEBUG -     Quantity found at line 88: 5
2026-01-19 13:27:19,358 - DEBUG -     Found discount at line 88: 5.0%
2026-01-19 13:27:19,359 - DEBUG -     Price after discount at line 89: 1155.6
2026-01-19 13:27:19,360 - DEBUG -     Price after discount at line 90: 5778.0
2026-01-19 13:27:19,361 - DEBUG -     Selected Bid Ext SVP (2nd price after discount): 5778.0 (from line 90)
2026-01-19 13:27:19,361 - DEBUG -     Final: Part=D0LW2ZX, Desc=Planning Analytics, Start=06/11/2025, End=30/11/2028, Qty=5, Price=5778.0
2026-01-19 13:27:19,361 - DEBUG -     ✓ Row added successfully
2026-01-19 13:27:19,362 - DEBUG - 
  Row 5 (line 96):
2026-01-19 13:27:19,362 - DEBUG -     Raw line: 'D22RMLL'
2026-01-19 13:27:19,363 - DEBUG -     Part Number found: 'D22RMLL'
2026-01-19 13:27:19,363 - DEBUG -     Description: 'Planning Analytics...'
2026-01-19 13:27:19,363 - DEBUG -     Found dates at line 100: ['06/11/2025']
2026-01-19 13:27:19,364 - DEBUG -     Found dates at line 101: ['30/11/2028']
2026-01-19 13:27:19,364 - DEBUG -     Dates found: Start='06/11/2025', End='30/11/2028'
2026-01-19 13:27:19,365 - DEBUG -     Quantity found at line 102: 1
2026-01-19 13:27:19,365 - DEBUG -     Found discount at line 102: 1.0%
2026-01-19 13:27:19,366 - DEBUG -     Price after discount at line 103: 19260.0
2026-01-19 13:27:19,366 - DEBUG -     Price after discount at line 104: 19260.0
2026-01-19 13:27:19,366 - DEBUG -     Selected Bid Ext SVP (2nd price after discount): 19260.0 (from line 104)
2026-01-19 13:27:19,367 - DEBUG -     Final: Part=D22RMLL, Desc=Planning Analytics, Start=06/11/2025, End=30/11/2028, Qty=1, Price=19260.0
2026-01-19 13:27:19,367 - DEBUG -     ✓ Row added successfully
2026-01-19 13:27:19,368 - DEBUG - 
[STRATEGY 2 COMPLETE] Extracted 5 rows using text-based extraction
2026-01-19 13:27:19,369 - DEBUG - 
Final extracted data summary:
2026-01-19 13:27:19,369 - DEBUG -   Row 1: Part=D11C4LL, Qty=1, Price=17352.0
2026-01-19 13:27:19,369 - DEBUG -   Row 2: Part=D1RJ6LL, Qty=2, Price=17352.0
2026-01-19 13:27:19,370 - DEBUG -   Row 3: Part=D1RJ8LL, Qty=48, Price=278208.0
2026-01-19 13:27:19,370 - DEBUG -   Row 4: Part=D0LW2ZX, Qty=5, Price=5778.0
2026-01-19 13:27:19,370 - DEBUG -   Row 5: Part=D22RMLL, Qty=1, Price=19260.0
2026-01-19 13:27:19,371 - DEBUG - ================================================================================

